timestamp,raw_sentence,corrected_sentence,time_taken_sec,accuracy_score
2026-06-22T00:56:26.338085,testing testing one two three testing testing,"testing, testing, one, two, three, testing, testing",,
2026-06-22T00:56:46.352015,this is the second test this is the second test,This is the second test.,,
2026-06-22T00:59:40.969340,this is one more test change the functions slightly this is one more test,This is one more test. Change the functions slightly. This is one more test.,,
2026-06-22T01:01:51.640176,this is i think of the fifth test know is i think the fifth test now,"This is, I think, the fifth test. Now I think it’s the fifth test.",,
2026-06-22T01:14:01.924380,bolting up the waske input to reach twenty five lines,Bolting up the task input to reach twenty-five lines.,,
2026-06-22T01:14:15.244424,creating even more input for the ulama file want to have twenty five lines,Create an additional 25 lines for the ulama file.,,
2026-06-22T01:14:28.635833,adding more to the dataset creating more input another test test test,"Adding more data to the dataset, creating more inputs, and conducting further tests.",,
2026-06-22T01:14:39.469725,creating more input for the dataset,creating more data for the dataset,,
2026-06-22T01:14:51.375393,another test for ollama,Another test for Ollama.,,
2026-06-22T01:15:03.745080,testing one two three four five,"testing one, two, three, four, five",,
2026-06-22T01:15:15.331275,more input for,more input,,
2026-06-22T01:15:31.154371,continuing testing until reaching the right amount of input files rose rather,continuing to test until reaching the appropriate amount of input files rose.,,
2026-06-22T01:15:42.479037,even more input for this folder,even more input for this folder,,
2026-06-22T01:16:05.095949,to him,to him,,
2026-06-22T01:16:15.468825,test number sixteen,Test number sixteen,,
2026-06-22T01:16:28.149430,put put number seventeen,Put number seventeen.,,
2026-06-22T01:16:40.411539,infinite number eighteen,infinite number of eighteen,,
2026-06-22T01:16:50.180133,and number nineteen,Number nineteen,,
2026-06-22T01:17:03.608850,this is impotent number twenty,This is important number twenty.,,
2026-06-22T01:17:15.698905,this is text number twenty one,This is text number twenty-one.,,
2026-06-22T01:17:27.423449,text number when teeth to,text number when times to,,
2026-06-22T01:17:37.717717,touch,touch,,
2026-06-22T01:17:48.706987,test number twenty four,Test number twenty-four,,
2026-06-22T01:17:58.510328,test twenty five,test twenty-five,,
2026-06-22T01:18:13.469378,the extra bits of data to get it well over the minimum required rows,the additional data needed to exceed the minimum required rows,,
2026-06-22T01:18:23.374063,few more tests,Few more tests,,
2026-06-22T01:18:37.476216,more testing rows for this,more test rows for this,,
2026-06-22T02:05:03.432513,one more test last final test
